{
  "protocol_version": "1.0",
  "worker_id": "home-windows",
  "instance_id": "f4f209d7-d3ef-4b9c-9c98-5fc8b94f7e86",
  "seq": 13,
  "sent_at": "2026-10-04T02:00:00Z",
  "capabilities": {
    "responses_http": true,
    "responses_nonstream": true,
    "quota_read": false,
    "account_usage_read": false
  },
  "local": {
    "bridge_ready": true,
    "adapter_status": "running",
    "adapter_ready": true,
    "auth_state": "ready",
    "active_requests": 0,
    "last_inference_success_at": "2026-10-04T01:59:45Z"
  },
  "quota": {
    "status": "unsupported",
    "source": "none",
    "captured_at": null,
    "last_attempt_at": "2026-10-04T01:59:00Z",
    "account_epoch": "a2a973fe-0c86-4f4d-87c4-78d5f031dbae",
    "account_alias": "合成测试账号",
    "identity_check": "manual_confirmed",
    "plan_type": null,
    "windows": [],
    "credits": null,
    "error_code": "rate_limits_not_supported"
  },
  "account_usage": null,
  "command_results": []
}
